[
  {
    "event_id": "evt-001",
    "session_id": "s-008",
    "sequence": 1,
    "event_type": "session_created",
    "occurred_at": "2026-09-19T17:00:00Z",
    "actor": "system",
    "source_evidence_ids": [],
    "payload": {
      "title": "Current Topic Override",
      "goal": "Human Overrideの再開Policyを確認する"
    }
  },
  {
    "event_id": "evt-002",
    "session_id": "s-008",
    "sequence": 2,
    "event_type": "session_started",
    "occurred_at": "2026-09-19T17:00:00Z",
    "actor": "system",
    "source_evidence_ids": [],
    "payload": {}
  },
  {
    "event_id": "evt-003",
    "session_id": "s-008",
    "sequence": 3,
    "event_type": "node_detected",
    "occurred_at": "2026-09-19T17:00:03Z",
    "actor": "analyzer",
    "source_evidence_ids": ["evd-001"],
    "payload": {
      "node_type": "topic",
      "label": "Pricing"
    }
  },
  {
    "event_id": "evt-004",
    "session_id": "s-008",
    "sequence": 4,
    "event_type": "node_detected",
    "occurred_at": "2026-09-19T17:00:04Z",
    "actor": "analyzer",
    "source_evidence_ids": ["evd-002"],
    "payload": {
      "node_type": "topic",
      "label": "MVP範囲"
    }
  },
  {
    "event_id": "evt-005",
    "session_id": "s-008",
    "sequence": 5,
    "event_type": "topic_focus_changed",
    "occurred_at": "2026-09-19T17:00:05Z",
    "actor": "analyzer",
    "source_evidence_ids": ["evd-001"],
    "payload": {
      "topic_id": "node:s-008:evt-003",
      "confidence": 0.93
    }
  },
  {
    "event_id": "evt-006",
    "session_id": "s-008",
    "sequence": 6,
    "event_type": "set_current_topic",
    "occurred_at": "2026-09-19T17:00:06Z",
    "actor": "human",
    "source_evidence_ids": ["evd-002"],
    "expected_revision": 5,
    "payload": {
      "topic_id": "node:s-008:evt-004"
    }
  },
  {
    "event_id": "evt-007",
    "session_id": "s-008",
    "sequence": 7,
    "event_type": "node_detected",
    "occurred_at": "2026-09-19T17:00:07Z",
    "actor": "analyzer",
    "source_evidence_ids": ["evd-003"],
    "payload": {
      "node_type": "idea",
      "label": "価格の表示方式を検討する"
    }
  },
  {
    "event_id": "evt-008",
    "session_id": "s-008",
    "sequence": 8,
    "event_type": "relation_detected",
    "occurred_at": "2026-09-19T17:00:08Z",
    "actor": "analyzer",
    "source_evidence_ids": ["evd-003"],
    "payload": {
      "source_node_id": "node:s-008:evt-003",
      "target_node_id": "node:s-008:evt-007",
      "relation_type": "contains"
    }
  },
  {
    "event_id": "evt-009",
    "session_id": "s-008",
    "sequence": 9,
    "event_type": "move_to_parking_lot",
    "occurred_at": "2026-09-19T17:00:09Z",
    "actor": "human",
    "source_evidence_ids": [],
    "expected_revision": 8,
    "payload": {
      "node_id": "node:s-008:evt-004"
    }
  },
  {
    "event_id": "evt-010",
    "session_id": "s-008",
    "sequence": 10,
    "event_type": "restore_from_parking_lot",
    "occurred_at": "2026-09-19T17:00:10Z",
    "actor": "human",
    "source_evidence_ids": [],
    "expected_revision": 9,
    "payload": {
      "node_id": "node:s-008:evt-004"
    }
  },
  {
    "event_id": "evt-011",
    "session_id": "s-008",
    "sequence": 11,
    "event_type": "set_current_topic",
    "occurred_at": "2026-09-19T17:00:11Z",
    "actor": "human",
    "source_evidence_ids": [],
    "expected_revision": 10,
    "payload": {
      "topic_id": "node:s-008:evt-004"
    }
  }
]
