[
  {
    "event_id": "evt-001",
    "session_id": "s-013",
    "sequence": 1,
    "event_type": "session_created",
    "occurred_at": "2026-09-19T18:00:00Z",
    "actor": "system",
    "source_evidence_ids": [],
    "payload": {
      "title": "Open Item Lifecycle",
      "goal": "Open Itemの解決と再開をReplay可能にする"
    }
  },
  {
    "event_id": "evt-002",
    "session_id": "s-013",
    "sequence": 2,
    "event_type": "session_started",
    "occurred_at": "2026-09-19T18:00:00Z",
    "actor": "system",
    "source_evidence_ids": [],
    "payload": {}
  },
  {
    "event_id": "evt-003",
    "session_id": "s-013",
    "sequence": 3,
    "event_type": "node_detected",
    "occurred_at": "2026-09-19T18:00:03Z",
    "actor": "analyzer",
    "source_evidence_ids": ["evd-001"],
    "payload": {
      "node_type": "topic",
      "label": "Visual Artifactの扱い"
    }
  },
  {
    "event_id": "evt-004",
    "session_id": "s-013",
    "sequence": 4,
    "event_type": "topic_focus_changed",
    "occurred_at": "2026-09-19T18:00:04Z",
    "actor": "analyzer",
    "source_evidence_ids": ["evd-001"],
    "payload": {
      "topic_id": "node:s-013:evt-003",
      "confidence": 0.95
    }
  },
  {
    "event_id": "evt-005",
    "session_id": "s-013",
    "sequence": 5,
    "event_type": "node_detected",
    "occurred_at": "2026-09-19T18:00:05Z",
    "actor": "analyzer",
    "source_evidence_ids": ["evd-002"],
    "payload": {
      "node_type": "open_item",
      "label": "Visual生成の完了条件"
    }
  },
  {
    "event_id": "evt-006",
    "session_id": "s-013",
    "sequence": 6,
    "event_type": "relation_detected",
    "occurred_at": "2026-09-19T18:00:06Z",
    "actor": "analyzer",
    "source_evidence_ids": ["evd-002"],
    "payload": {
      "source_node_id": "node:s-013:evt-003",
      "target_node_id": "node:s-013:evt-005",
      "relation_type": "contains"
    }
  },
  {
    "event_id": "evt-007",
    "session_id": "s-013",
    "sequence": 7,
    "event_type": "resolve_open_item",
    "occurred_at": "2026-09-19T18:00:07Z",
    "actor": "human",
    "source_evidence_ids": [],
    "expected_revision": 6,
    "payload": {
      "open_item_node_id": "node:s-013:evt-005",
      "expected_status": "active"
    }
  },
  {
    "event_id": "evt-008",
    "session_id": "s-013",
    "sequence": 8,
    "event_type": "reopen_open_item",
    "occurred_at": "2026-09-19T18:00:08Z",
    "actor": "human",
    "source_evidence_ids": [],
    "expected_revision": 7,
    "payload": {
      "open_item_node_id": "node:s-013:evt-005",
      "expected_status": "resolved"
    }
  },
  {
    "event_id": "evt-009",
    "session_id": "s-013",
    "sequence": 9,
    "event_type": "resolve_open_item",
    "occurred_at": "2026-09-19T18:00:09Z",
    "actor": "human",
    "source_evidence_ids": [],
    "expected_revision": 8,
    "payload": {
      "open_item_node_id": "node:s-013:evt-005",
      "expected_status": "active"
    }
  }
]
