[
  {
    "event_id": "evt-001",
    "session_id": "s-009",
    "sequence": 1,
    "event_type": "session_created",
    "occurred_at": "2026-09-19T18:00:00Z",
    "actor": "system",
    "source_evidence_ids": [],
    "payload": {
      "title": "Undo",
      "goal": "最新Human CorrectionのUndoを確認する"
    }
  },
  {
    "event_id": "evt-002",
    "session_id": "s-009",
    "sequence": 2,
    "event_type": "session_started",
    "occurred_at": "2026-09-19T18:00:00Z",
    "actor": "system",
    "source_evidence_ids": [],
    "payload": {}
  },
  {
    "event_id": "evt-003",
    "session_id": "s-009",
    "sequence": 3,
    "event_type": "node_detected",
    "occurred_at": "2026-09-19T18:00:03Z",
    "actor": "analyzer",
    "source_evidence_ids": ["evd-001"],
    "payload": {
      "node_type": "topic",
      "label": "MVP範囲"
    }
  },
  {
    "event_id": "evt-004",
    "session_id": "s-009",
    "sequence": 4,
    "event_type": "rename_node",
    "occurred_at": "2026-09-19T18:00:04Z",
    "actor": "human",
    "source_evidence_ids": [],
    "expected_revision": 3,
    "payload": {
      "node_id": "node:s-009:evt-003",
      "label": "MVPの中心範囲"
    }
  },
  {
    "event_id": "evt-005",
    "session_id": "s-009",
    "sequence": 5,
    "event_type": "undo_last_correction",
    "occurred_at": "2026-09-19T18:00:05Z",
    "actor": "human",
    "source_evidence_ids": [],
    "expected_revision": 4,
    "payload": {
      "target_event_id": "evt-004"
    }
  }
]
