[
  {
    "event_id": "evt-001",
    "session_id": "s-002",
    "sequence": 1,
    "event_type": "session_created",
    "occurred_at": "2026-09-19T11:00:00Z",
    "actor": "system",
    "source_evidence_ids": [],
    "payload": {
      "title": "Topic Return",
      "goal": "Topicの再訪とFlowを確認する"
    }
  },
  {
    "event_id": "evt-002",
    "session_id": "s-002",
    "sequence": 2,
    "event_type": "session_started",
    "occurred_at": "2026-09-19T11:00:00Z",
    "actor": "system",
    "source_evidence_ids": [],
    "payload": {}
  },
  {
    "event_id": "evt-003",
    "session_id": "s-002",
    "sequence": 3,
    "event_type": "node_detected",
    "occurred_at": "2026-09-19T11:00:03Z",
    "actor": "analyzer",
    "source_evidence_ids": ["evd-001"],
    "payload": {
      "node_type": "topic",
      "label": "Discussion Map"
    }
  },
  {
    "event_id": "evt-004",
    "session_id": "s-002",
    "sequence": 4,
    "event_type": "topic_focus_changed",
    "occurred_at": "2026-09-19T11:00:04Z",
    "actor": "analyzer",
    "source_evidence_ids": ["evd-001"],
    "payload": {
      "topic_id": "node:s-002:evt-003",
      "confidence": 0.96
    }
  },
  {
    "event_id": "evt-005",
    "session_id": "s-002",
    "sequence": 5,
    "event_type": "node_detected",
    "occurred_at": "2026-09-19T11:00:05Z",
    "actor": "analyzer",
    "source_evidence_ids": ["evd-002"],
    "payload": {
      "node_type": "topic",
      "label": "Visual生成"
    }
  },
  {
    "event_id": "evt-006",
    "session_id": "s-002",
    "sequence": 6,
    "event_type": "topic_focus_changed",
    "occurred_at": "2026-09-19T11:00:06Z",
    "actor": "analyzer",
    "source_evidence_ids": ["evd-002"],
    "payload": {
      "topic_id": "node:s-002:evt-005",
      "previous_topic_id": "node:s-002:evt-003",
      "confidence": 0.88
    }
  },
  {
    "event_id": "evt-007",
    "session_id": "s-002",
    "sequence": 7,
    "event_type": "node_detected",
    "occurred_at": "2026-09-19T11:00:07Z",
    "actor": "analyzer",
    "source_evidence_ids": ["evd-003"],
    "payload": {
      "node_type": "topic",
      "label": "料金モデル"
    }
  },
  {
    "event_id": "evt-008",
    "session_id": "s-002",
    "sequence": 8,
    "event_type": "topic_focus_changed",
    "occurred_at": "2026-09-19T11:00:08Z",
    "actor": "analyzer",
    "source_evidence_ids": ["evd-003"],
    "payload": {
      "topic_id": "node:s-002:evt-007",
      "previous_topic_id": "node:s-002:evt-005",
      "confidence": 0.86
    }
  },
  {
    "event_id": "evt-009",
    "session_id": "s-002",
    "sequence": 9,
    "event_type": "topic_focus_changed",
    "occurred_at": "2026-09-19T11:00:09Z",
    "actor": "analyzer",
    "source_evidence_ids": ["evd-004"],
    "payload": {
      "topic_id": "node:s-002:evt-003",
      "previous_topic_id": "node:s-002:evt-007",
      "confidence": 0.95
    }
  }
]
