[
  {
    "event_id": "evt-001",
    "session_id": "s-001",
    "sequence": 1,
    "event_type": "session_created",
    "occurred_at": "2026-09-19T10:00:00Z",
    "actor": "system",
    "source_evidence_ids": [],
    "payload": {
      "title": "Basic Discussion",
      "goal": "MVPの中心価値を整理する"
    }
  },
  {
    "event_id": "evt-002",
    "session_id": "s-001",
    "sequence": 2,
    "event_type": "session_started",
    "occurred_at": "2026-09-19T10:00:00Z",
    "actor": "system",
    "source_evidence_ids": [],
    "payload": {}
  },
  {
    "event_id": "evt-003",
    "session_id": "s-001",
    "sequence": 3,
    "event_type": "node_detected",
    "occurred_at": "2026-09-19T10:00:03Z",
    "actor": "analyzer",
    "source_evidence_ids": ["evd-001"],
    "payload": {
      "node_type": "topic",
      "label": "MVPの中心価値"
    }
  },
  {
    "event_id": "evt-004",
    "session_id": "s-001",
    "sequence": 4,
    "event_type": "topic_focus_changed",
    "occurred_at": "2026-09-19T10:00:04Z",
    "actor": "analyzer",
    "source_evidence_ids": ["evd-001"],
    "payload": {
      "topic_id": "node:s-001:evt-003",
      "confidence": 0.95
    }
  },
  {
    "event_id": "evt-005",
    "session_id": "s-001",
    "sequence": 5,
    "event_type": "node_detected",
    "occurred_at": "2026-09-19T10:00:05Z",
    "actor": "analyzer",
    "source_evidence_ids": ["evd-001"],
    "payload": {
      "node_type": "idea",
      "label": "Discussion Mapを中心にする"
    }
  },
  {
    "event_id": "evt-006",
    "session_id": "s-001",
    "sequence": 6,
    "event_type": "node_detected",
    "occurred_at": "2026-09-19T10:00:06Z",
    "actor": "analyzer",
    "source_evidence_ids": ["evd-002", "evd-003"],
    "payload": {
      "node_type": "idea",
      "label": "文字起こしが必要"
    }
  },
  {
    "event_id": "evt-007",
    "session_id": "s-001",
    "sequence": 7,
    "event_type": "relation_detected",
    "occurred_at": "2026-09-19T10:00:07Z",
    "actor": "analyzer",
    "source_evidence_ids": ["evd-001"],
    "payload": {
      "source_node_id": "node:s-001:evt-003",
      "target_node_id": "node:s-001:evt-005",
      "relation_type": "contains"
    }
  },
  {
    "event_id": "evt-008",
    "session_id": "s-001",
    "sequence": 8,
    "event_type": "relation_detected",
    "occurred_at": "2026-09-19T10:00:08Z",
    "actor": "analyzer",
    "source_evidence_ids": ["evd-002"],
    "payload": {
      "source_node_id": "node:s-001:evt-003",
      "target_node_id": "node:s-001:evt-006",
      "relation_type": "contains"
    }
  },
  {
    "event_id": "evt-009",
    "session_id": "s-001",
    "sequence": 9,
    "event_type": "relation_detected",
    "occurred_at": "2026-09-19T10:00:09Z",
    "actor": "analyzer",
    "source_evidence_ids": ["evd-003"],
    "payload": {
      "source_node_id": "node:s-001:evt-005",
      "target_node_id": "node:s-001:evt-006",
      "relation_type": "related_to"
    }
  }
]
